Sheet: Personal Budget
A1: 2016
A2: Income | B2: Month | C2: January | D2: February | E2: March | F2: April | G2: May | H2: June | I2: July | J2: August | K2: September | L2: October | M2: November | N2: December | P2: Total for Year
B3: Paycheck 1 | C3: 1300.45 | P3: of:=SUM([.C3:.N3]) -> 1300.45
B4: Paycheck 2 | C4: 11722.32 | P4: of:=SUM([.C4:.N4]) -> 11722.32
B5: Interest | P5: of:=SUM([.C5:.N5]) -> 0
B6: Other Income | P6: of:=SUM([.C6:.N6]) -> 0
B7: Total Income | C7: of:=SUM([.C3:.C6]) -> 13022.77 | D7: of:=SUM([.D3:.D6]) -> 0 | E7: of:=SUM([.E3:.E6]) -> 0 | F7: of:=SUM([.F3:.F6]) -> 0 | G7: of:=SUM([.G3:.G6]) -> 0 | H7: of:=SUM([.H3:.H6]) -> 0 | I7: of:=SUM([.I3:.I6]) -> 0 | J7: of:=SUM([.J3:.J6]) -> 0 | K7: of:=SUM([.K3:.K6]) -> 0 | L7: of:=SUM([.L3:.L6]) -> 0 | M7: of:=SUM([.M3:.M6]) -> 0 | N7: of:=SUM([.N3:.N6]) -> 0 | P7: of:=SUM([.C7:.N7]) -> 13022.77
A9: Expenses | B9: Month | C9: January | D9: February | E9: March | F9: April | G9: May | H9: June | I9: July | J9: August | K9: September | L9: October | M9: November | N9: December | P9: Total for Year
B10: Rent/Mortgage | C10: 354.78 | P10: of:=SUM([.C10:.N10]) -> 354.78
B11: Electric | C11: 89.34 | P11: of:=SUM([.C11:.N11]) -> 89.34
B12: Natural Gas | P12: of:=SUM([.C12:.N12]) -> 0
B13: Water | P13: of:=SUM([.C13:.N13]) -> 0
B14: Sewer | P14: of:=SUM([.C14:.N14]) -> 0
B15: Waste Disposal | P15: of:=SUM([.C15:.N15]) -> 0
B16: Car Payment | P16: of:=SUM([.C16:.N16]) -> 0
B17: Car Repairs | P17: of:=SUM([.C17:.N17]) -> 0
B18: Car Insurance | P18: of:=SUM([.C18:.N18]) -> 0
B19: Gas | P19: of:=SUM([.C19:.N19]) -> 0
B20: Phone | P20: of:=SUM([.C20:.N20]) -> 0
B21: Cell Phone | P21: of:=SUM([.C21:.N21]) -> 0
B22: Internet | P22: of:=SUM([.C22:.N22]) -> 0
B23: Clothes | P23: of:=SUM([.C23:.N23]) -> 0
B24: Entertainment | P24: of:=SUM([.C24:.N24]) -> 0
B25: School Expenses | P25: of:=SUM([.C25:.N25]) -> 0
B26: Bank Charges | P26: of:=SUM([.C26:.N26]) -> 0
B27: Misc. | P27: of:=SUM([.C27:.N27]) -> 0
B28: Total Expenses | C28: of:=SUM([.C10:.C27]) -> 444.12 | D28: of:=SUM([.D10:.D27]) -> 0 | E28: of:=SUM([.E10:.E27]) -> 0 | F28: of:=SUM([.F10:.F27]) -> 0 | G28: of:=SUM([.G10:.G27]) -> 0 | H28: of:=SUM([.H10:.H27]) -> 0 | I28: of:=SUM([.I10:.I27]) -> 0 | J28: of:=SUM([.J10:.J27]) -> 0 | K28: of:=SUM([.K10:.K27]) -> 0 | L28: of:=SUM([.L10:.L27]) -> 0 | M28: of:=SUM([.M10:.M27]) -> 0 | N28: of:=SUM([.N10:.N27]) -> 0 | P28: of:=SUM([.C28:.N28]) -> 444.12
A30: Net Income | B30: Month | C30: January | D30: February | E30: March | F30: April | G30: May | H30: June | I30: July | J30: August | K30: September | L30: October | M30: November | N30: December | P30: Total for Year
B31: Total Income | C31: of:=[.C7] -> 13022.77 | D31: of:=[.D7] -> 0 | E31: of:=[.E7] -> 0 | F31: of:=[.F7] -> 0 | G31: of:=[.G7] -> 0 | H31: of:=[.H7] -> 0 | I31: of:=[.I7] -> 0 | J31: of:=[.J7] -> 0 | K31: of:=[.K7] -> 0 | L31: of:=[.L7] -> 0 | M31: of:=[.M7] -> 0 | N31: of:=[.N7] -> 0 | P31: of:=SUM([.C31:.N31]) -> 13022.77
B32: Total Expenses | C32: of:=[.C28] -> 444.12 | D32: of:=[.D28] -> 0 | E32: of:=[.E28] -> 0 | F32: of:=[.F28] -> 0 | G32: of:=[.G28] -> 0 | H32: of:=[.H28] -> 0 | I32: of:=[.I28] -> 0 | J32: of:=[.J28] -> 0 | K32: of:=[.K28] -> 0 | L32: of:=[.L28] -> 0 | M32: of:=[.M28] -> 0 | N32: of:=[.N28] -> 0 | P32: of:=SUM([.C32:.N32]) -> 444.12
B33: Total Net Income | C33: of:=[.C31]-[.C32] -> 12578.65 | D33: of:=[.D31]-[.D32] -> 0 | E33: of:=[.E31]-[.E32] -> 0 | F33: of:=[.F31]-[.F32] -> 0 | G33: of:=[.G31]-[.G32] -> 0 | H33: of:=[.H31]-[.H32] -> 0 | I33: of:=[.I31]-[.I32] -> 0 | J33: of:=[.J31]-[.J32] -> 0 | K33: of:=[.K31]-[.K32] -> 0 | L33: of:=[.L31]-[.L32] -> 0 | M33: of:=[.M31]-[.M32] -> 0 | N33: of:=[.N31]-[.N32] -> 0 | P33: of:=SUM([.C33:.N33]) -> 12578.65
B35: Cumulative Net Income | C35: of:=[.C33] -> 12578.65 | D35: of:=[.C35]+[.D33] -> 12578.65 | E35: of:=[.D35]+[.E33] -> 12578.65 | F35: of:=[.E35]+[.F33] -> 12578.65 | G35: of:=[.F35]+[.G33] -> 12578.65 | H35: of:=[.G35]+[.H33] -> 12578.65 | I35: of:=[.H35]+[.I33] -> 12578.65 | J35: of:=[.I35]+[.J33] -> 12578.65 | K35: of:=[.J35]+[.K33] -> 12578.65 | L35: of:=[.K35]+[.L33] -> 12578.65 | M35: of:=[.L35]+[.M33] -> 12578.65 | N35: of:=[.M35]+[.N33] -> 12578.65 | P35: of:=[.N35] -> 12578.65